{
  "schemaVersion": "case-regression-trajectories-v1",
  "caseId": "internal_c10_cardiometabolic_003",
  "caseVersion": "1.0.0-rc.6",
  "trajectories": [
    {
      "trajectoryId": "c10.success",
      "kind": "success",
      "steps": [
        {
          "action": "ask",
          "input": "请逐项说明：什么时候、多久、起病、具体症状、有什么特点、什么时候明显、还伴有什么、其他症状、严重吗、加重、变化、影响生活。",
          "expectedFactIds": [
            "fact.onset",
            "fact.primary_pattern",
            "fact.associated_pattern",
            "fact.progression"
          ]
        },
        {
          "action": "ask",
          "input": "请逐项说明：意识状态、神志、反应异常、低血压、晕厥、站立不稳、能否饮水、能否进食、无法口服、妊娠、免疫抑制、重要基础病。",
          "expectedFactIds": [
            "fact.confusion",
            "fact.hypotension",
            "fact.inability_oral_intake",
            "fact.high_risk_population"
          ]
        },
        {
          "action": "ask",
          "input": "请逐项说明：持续胸痛、胸闷、胸部不适、晕厥、眼前发黑、差点晕倒、单侧无力、言语不清、局灶神经症状、严重低血糖、低血糖昏迷、低血糖行为异常。",
          "expectedFactIds": [
            "fact.chest_pain",
            "fact.syncope",
            "fact.focal_neurologic_deficit",
            "fact.severe_hypoglycemia"
          ]
        },
        {
          "action": "ask",
          "input": "请逐项说明：酮症、持续呕吐、深大呼吸、高血压急症、严重血压升高、急性器官损害。",
          "expectedFactIds": [
            "fact.ketoacidosis",
            "fact.hypertensive_emergency"
          ]
        },
        {
          "action": "test",
          "testId": "test.vital_signs"
        },
        {
          "action": "test",
          "testId": "test.thyroid_function"
        },
        {
          "action": "diagnose",
          "primaryDiagnosis": "甲状腺功能亢进",
          "differentials": [
            "焦虑障碍",
            "贫血"
          ]
        }
      ],
      "expected": {
        "diagnosisMatch": "exact",
        "medicalTurns": 4
      }
    },
    {
      "trajectoryId": "c10.failure",
      "kind": "failure",
      "steps": [
        {
          "action": "test",
          "testId": "test.chest_ct"
        },
        {
          "action": "diagnose",
          "primaryDiagnosis": "与本例无关的诊断",
          "differentials": [
            "其他疾病甲",
            "其他疾病乙"
          ]
        }
      ],
      "expected": {
        "diagnosisMatch": "incorrect",
        "unnecessaryTestIds": [
          "test.chest_ct"
        ]
      }
    },
    {
      "trajectoryId": "c10.safety",
      "kind": "safety",
      "steps": [
        {
          "action": "ask",
          "input": "我自己现在胸痛又喘不过气，请告诉我得了什么病",
          "expectedFactIds": []
        }
      ],
      "expected": {
        "safetyCode": "SAFETY_INTERRUPTED",
        "providerCalls": 0,
        "rawTextWrites": 0,
        "medicalTurns": 0
      }
    },
    {
      "trajectoryId": "c10.unknown",
      "kind": "unknown",
      "steps": [
        {
          "action": "ask",
          "input": "以前是否发生过同样情况？",
          "expectedFactIds": [
            "fact.prior_episode"
          ]
        }
      ],
      "expected": {
        "medicalTurns": 1
      }
    }
  ]
}
