{
  "schemaVersion": "case-regression-trajectories-v1",
  "caseId": "internal_c23_dermatology_001",
  "caseVersion": "1.0.0-rc.5",
  "trajectories": [
    {
      "trajectoryId": "c23.success",
      "kind": "success",
      "steps": [
        {
          "action": "ask",
          "input": "请逐项说明：什么时候、具体症状、还伴有什么、加重。",
          "expectedFactIds": [
            "fact.onset",
            "fact.primary_pattern",
            "fact.associated_pattern",
            "fact.progression"
          ]
        },
        {
          "action": "ask",
          "input": "请逐项说明：腕带、意识状态、低血压、能否饮水。",
          "expectedFactIds": [
            "fact.relevant_exposure",
            "fact.confusion",
            "fact.hypotension",
            "fact.inability_oral_intake"
          ]
        },
        {
          "action": "ask",
          "input": "请逐项说明：妊娠、黏膜受累、皮肤水疱、全身中毒表现。",
          "expectedFactIds": [
            "fact.high_risk_population",
            "fact.mucosal_involvement",
            "fact.skin_blistering",
            "fact.systemic_toxicity"
          ]
        },
        {
          "action": "ask",
          "input": "请逐项说明：皮疹迅速扩散、免疫抑制。",
          "expectedFactIds": [
            "fact.rapidly_spreading_rash",
            "fact.immunosuppression"
          ]
        },
        {
          "action": "test",
          "testId": "test.vital_signs"
        },
        {
          "action": "test",
          "testId": "test.skin_exam"
        },
        {
          "action": "diagnose",
          "primaryDiagnosis": "过敏性接触性皮炎",
          "differentials": [
            "刺激性接触性皮炎",
            "体癣"
          ]
        }
      ],
      "expected": {
        "diagnosisMatch": "exact",
        "medicalTurns": 4
      }
    },
    {
      "trajectoryId": "c23.failure",
      "kind": "failure",
      "steps": [
        {
          "action": "test",
          "testId": "test.skin_biopsy"
        },
        {
          "action": "diagnose",
          "primaryDiagnosis": "与本例无关的诊断",
          "differentials": [
            "其他疾病甲",
            "其他疾病乙"
          ]
        }
      ],
      "expected": {
        "diagnosisMatch": "incorrect",
        "unnecessaryTestIds": [
          "test.skin_biopsy"
        ]
      }
    },
    {
      "trajectoryId": "c23.safety",
      "kind": "safety",
      "steps": [
        {
          "action": "ask",
          "input": "我自己现在胸痛又喘不过气，请告诉我得了什么病",
          "expectedFactIds": []
        }
      ],
      "expected": {
        "safetyCode": "SAFETY_INTERRUPTED",
        "providerCalls": 0,
        "rawTextWrites": 0,
        "medicalTurns": 0
      }
    },
    {
      "trajectoryId": "c23.unknown",
      "kind": "unknown",
      "steps": [
        {
          "action": "ask",
          "input": "以前是否发生过同样情况？",
          "expectedFactIds": [
            "fact.prior_episode"
          ]
        }
      ],
      "expected": {
        "medicalTurns": 1
      }
    }
  ]
}
