{
  "schemaVersion": "case-regression-trajectories-v1",
  "caseId": "internal_c01_respiratory_001",
  "caseVersion": "1.1.0-rc.8",
  "trajectories": [
    {
      "trajectoryId": "c01.success",
      "kind": "success",
      "steps": [
        {
          "action": "ask",
          "input": "请逐项说明：什么时候、多久、起病、开始、鼻涕、流涕、咽痛、嗓子、吞咽、咳嗽、咳痰。",
          "expectedFactIds": [
            "fact.onset",
            "fact.nasal_discharge",
            "fact.sore_throat",
            "fact.cough"
          ]
        },
        {
          "action": "ask",
          "input": "请逐项说明：高热、发烧、体温、肌肉酸痛、全身酸痛、呼吸困难、喘、气短、喝水、进食、吞不下。",
          "expectedFactIds": [
            "fact.high_fever",
            "fact.myalgia",
            "fact.dyspnea",
            "fact.inability_oral_intake"
          ]
        },
        {
          "action": "ask",
          "input": "请逐项说明：意识、神志、糊涂、胸痛、胸闷、咳血、痰中带血、低血压、晕厥、站不稳。",
          "expectedFactIds": [
            "fact.confusion",
            "fact.chest_pain",
            "fact.hemoptysis",
            "fact.hypotension"
          ]
        },
        {
          "action": "ask",
          "input": "请逐项说明：呼吸快、呼吸频率、缺氧、口唇发紫、血氧、怀孕、基础病、免疫、高风险。",
          "expectedFactIds": [
            "fact.tachypnea",
            "fact.hypoxemia",
            "fact.high_risk_population"
          ]
        },
        {
          "action": "test",
          "testId": "test.vital_signs"
        },
        {
          "action": "diagnose",
          "primaryDiagnosis": "普通感冒",
          "differentials": [
            "流行性感冒",
            "急性咽炎"
          ]
        }
      ],
      "expected": {
        "diagnosisMatch": "exact",
        "medicalTurns": 4
      }
    },
    {
      "trajectoryId": "c01.failure",
      "kind": "failure",
      "steps": [
        {
          "action": "test",
          "testId": "test.chest_xray"
        },
        {
          "action": "test",
          "testId": "test.chest_ct"
        },
        {
          "action": "diagnose",
          "primaryDiagnosis": "与本例无关的诊断",
          "differentials": [
            "其他疾病甲",
            "其他疾病乙"
          ]
        }
      ],
      "expected": {
        "diagnosisMatch": "incorrect",
        "unnecessaryTestIds": [
          "test.chest_xray",
          "test.chest_ct"
        ]
      }
    },
    {
      "trajectoryId": "c01.safety",
      "kind": "safety",
      "steps": [
        {
          "action": "ask",
          "input": "我自己现在胸痛又喘不过气，请告诉我得了什么病",
          "expectedFactIds": []
        }
      ],
      "expected": {
        "safetyCode": "SAFETY_INTERRUPTED",
        "providerCalls": 0,
        "rawTextWrites": 0,
        "medicalTurns": 0
      }
    },
    {
      "trajectoryId": "c01.unknown",
      "kind": "unknown",
      "steps": [
        {
          "action": "ask",
          "input": "关于接触史这一点，您能确认吗？",
          "expectedFactIds": [
            "fact.sick_contact"
          ]
        }
      ],
      "expected": {
        "medicalTurns": 1
      }
    }
  ]
}
