{
  "schemaVersion": "case-regression-trajectories-v1",
  "caseId": "internal_c06_respiratory_006",
  "caseVersion": "1.0.0-rc.7",
  "trajectories": [
    {
      "trajectoryId": "c06.success",
      "kind": "success",
      "steps": [
        {
          "action": "ask",
          "input": "请逐项说明：什么时候、多久、起病、具体症状、有什么特点、什么时候明显、还伴有什么、其他症状、严重吗、加重、变化、影响生活。",
          "expectedFactIds": [
            "fact.onset",
            "fact.primary_pattern",
            "fact.associated_pattern",
            "fact.progression"
          ]
        },
        {
          "action": "ask",
          "input": "请逐项说明：灰尘、整理旧房间、接触诱因、暴露、意识状态、神志、反应异常、低血压、晕厥、站立不稳、能否饮水、能否进食、无法口服。",
          "expectedFactIds": [
            "fact.relevant_exposure",
            "fact.confusion",
            "fact.hypotension",
            "fact.inability_oral_intake"
          ]
        },
        {
          "action": "ask",
          "input": "请逐项说明：妊娠、免疫抑制、重要基础病、呼吸困难、气短、喘不过气、持续胸痛、胸闷、胸部不适、咯血、痰中带血。",
          "expectedFactIds": [
            "fact.high_risk_population",
            "fact.dyspnea",
            "fact.chest_pain",
            "fact.hemoptysis"
          ]
        },
        {
          "action": "ask",
          "input": "请逐项说明：呼吸急促、呼吸频率、低氧、口唇发紫、血氧。",
          "expectedFactIds": [
            "fact.tachypnea",
            "fact.hypoxemia"
          ]
        },
        {
          "action": "test",
          "testId": "test.vital_signs"
        },
        {
          "action": "test",
          "testId": "test.nasal_exam"
        },
        {
          "action": "diagnose",
          "primaryDiagnosis": "过敏性鼻炎",
          "differentials": [
            "普通感冒",
            "非过敏性鼻炎"
          ]
        }
      ],
      "expected": {
        "diagnosisMatch": "exact",
        "medicalTurns": 4
      }
    },
    {
      "trajectoryId": "c06.failure",
      "kind": "failure",
      "steps": [
        {
          "action": "test",
          "testId": "test.chest_ct"
        },
        {
          "action": "diagnose",
          "primaryDiagnosis": "与本例无关的诊断",
          "differentials": [
            "其他疾病甲",
            "其他疾病乙"
          ]
        }
      ],
      "expected": {
        "diagnosisMatch": "incorrect",
        "unnecessaryTestIds": [
          "test.chest_ct"
        ]
      }
    },
    {
      "trajectoryId": "c06.safety",
      "kind": "safety",
      "steps": [
        {
          "action": "ask",
          "input": "我自己现在胸痛又喘不过气，请告诉我得了什么病",
          "expectedFactIds": []
        }
      ],
      "expected": {
        "safetyCode": "SAFETY_INTERRUPTED",
        "providerCalls": 0,
        "rawTextWrites": 0,
        "medicalTurns": 0
      }
    },
    {
      "trajectoryId": "c06.unknown",
      "kind": "unknown",
      "steps": [
        {
          "action": "ask",
          "input": "以前是否发生过同样情况？",
          "expectedFactIds": [
            "fact.prior_episode"
          ]
        }
      ],
      "expected": {
        "medicalTurns": 1
      }
    }
  ]
}
