{
  "schemaVersion": "case-regression-trajectories-v1",
  "caseId": "internal_c26_pediatrics_002",
  "caseVersion": "1.0.0-rc.5",
  "trajectories": [
    {
      "trajectoryId": "c26.success",
      "kind": "success",
      "steps": [
        {
          "action": "ask",
          "input": "请逐项说明：什么时候、具体症状、还伴有什么、加重。",
          "expectedFactIds": [
            "fact.onset",
            "fact.primary_pattern",
            "fact.associated_pattern",
            "fact.progression"
          ]
        },
        {
          "action": "ask",
          "input": "请逐项说明：意识状态、低血压、能否饮水、妊娠。",
          "expectedFactIds": [
            "fact.confusion",
            "fact.hypotension",
            "fact.inability_oral_intake",
            "fact.high_risk_population"
          ]
        },
        {
          "action": "ask",
          "input": "请逐项说明：异常嗜睡、儿童脱水。",
          "expectedFactIds": [
            "fact.pediatric_lethargy",
            "fact.pediatric_dehydration"
          ]
        },
        {
          "action": "test",
          "testId": "test.vital_signs"
        },
        {
          "action": "test",
          "testId": "test.growth_assessment"
        },
        {
          "action": "diagnose",
          "primaryDiagnosis": "学龄儿童功能性腹痛",
          "differentials": [
            "便秘",
            "乳糜泻"
          ]
        }
      ],
      "expected": {
        "diagnosisMatch": "exact",
        "medicalTurns": 3
      }
    },
    {
      "trajectoryId": "c26.failure",
      "kind": "failure",
      "steps": [
        {
          "action": "test",
          "testId": "test.abdominal_ct"
        },
        {
          "action": "diagnose",
          "primaryDiagnosis": "与本例无关的诊断",
          "differentials": [
            "其他疾病甲",
            "其他疾病乙"
          ]
        }
      ],
      "expected": {
        "diagnosisMatch": "incorrect",
        "unnecessaryTestIds": [
          "test.abdominal_ct"
        ]
      }
    },
    {
      "trajectoryId": "c26.safety",
      "kind": "safety",
      "steps": [
        {
          "action": "ask",
          "input": "我自己现在胸痛又喘不过气，请告诉我得了什么病",
          "expectedFactIds": []
        }
      ],
      "expected": {
        "safetyCode": "SAFETY_INTERRUPTED",
        "providerCalls": 0,
        "rawTextWrites": 0,
        "medicalTurns": 0
      }
    },
    {
      "trajectoryId": "c26.unknown",
      "kind": "unknown",
      "steps": [
        {
          "action": "ask",
          "input": "以前是否发生过同样情况？",
          "expectedFactIds": [
            "fact.prior_episode"
          ]
        }
      ],
      "expected": {
        "medicalTurns": 1
      }
    }
  ]
}
