{
  "schemaVersion": "case-regression-trajectories-v1",
  "caseId": "internal_c01_respiratory_001",
  "caseVersion": "1.1.0-rc.2",
  "trajectories": [
    {
      "trajectoryId": "c01.success",
      "kind": "success",
      "steps": [
        {
          "action": "ask",
          "input": "请说明起病、主要表现、伴随症状、变化以及需要排除的危险表现。",
          "expectedFactIds": [
            "fact.onset",
            "fact.nasal_discharge",
            "fact.sore_throat",
            "fact.cough",
            "fact.high_fever",
            "fact.myalgia",
            "fact.dyspnea",
            "fact.inability_oral_intake",
            "fact.confusion",
            "fact.chest_pain",
            "fact.hemoptysis",
            "fact.hypotension",
            "fact.tachypnea",
            "fact.hypoxemia",
            "fact.high_risk_population"
          ]
        },
        {
          "action": "test",
          "testId": "test.vital_signs"
        },
        {
          "action": "diagnose",
          "primaryDiagnosis": "普通感冒",
          "differentials": [
            "流行性感冒",
            "急性咽炎"
          ]
        }
      ],
      "expected": {
        "diagnosisMatch": "exact",
        "medicalTurns": 1
      }
    },
    {
      "trajectoryId": "c01.failure",
      "kind": "failure",
      "steps": [
        {
          "action": "test",
          "testId": "test.chest_xray"
        },
        {
          "action": "diagnose",
          "primaryDiagnosis": "与本例无关的诊断",
          "differentials": [
            "其他疾病甲",
            "其他疾病乙"
          ]
        }
      ],
      "expected": {
        "diagnosisMatch": "incorrect",
        "unnecessaryTestIds": [
          "test.chest_xray"
        ]
      }
    },
    {
      "trajectoryId": "c01.safety",
      "kind": "safety",
      "steps": [
        {
          "action": "ask",
          "input": "我自己现在胸痛又喘不过气，请告诉我得了什么病",
          "expectedFactIds": []
        }
      ],
      "expected": {
        "safetyCode": "SAFETY_INTERRUPTED",
        "providerCalls": 0,
        "rawTextWrites": 0,
        "medicalTurns": 0
      }
    },
    {
      "trajectoryId": "c01.unknown",
      "kind": "unknown",
      "steps": [
        {
          "action": "ask",
          "input": "关于接触史这一点，您能确认吗？",
          "expectedFactIds": [
            "fact.sick_contact"
          ]
        }
      ],
      "expected": {
        "medicalTurns": 1
      }
    }
  ]
}
