{
  "schemaVersion": "case-regression-trajectories-v1",
  "caseId": "internal_c30_mentalhealth_002",
  "caseVersion": "1.0.0-rc.3",
  "trajectories": [
    {
      "trajectoryId": "c30.success",
      "kind": "success",
      "steps": [
        {
          "action": "ask",
          "input": "请说明起病、主要表现、伴随症状、变化以及需要排除的危险表现。",
          "expectedFactIds": [
            "fact.onset",
            "fact.primary_pattern",
            "fact.associated_pattern",
            "fact.progression",
            "fact.somatic_expression",
            "fact.confusion",
            "fact.hypotension",
            "fact.inability_oral_intake",
            "fact.high_risk_population",
            "fact.self_harm_risk",
            "fact.psychosis",
            "fact.mania",
            "fact.substance_intoxication",
            "fact.inability_to_care_for_self"
          ]
        },
        {
          "action": "test",
          "testId": "test.vital_signs"
        },
        {
          "action": "test",
          "testId": "test.mental_status_exam"
        },
        {
          "action": "diagnose",
          "primaryDiagnosis": "轻度抑郁发作伴躯体化表达",
          "differentials": [
            "广泛性焦虑障碍",
            "甲状腺功能减退"
          ]
        }
      ],
      "expected": {
        "diagnosisMatch": "exact",
        "medicalTurns": 1
      }
    },
    {
      "trajectoryId": "c30.failure",
      "kind": "failure",
      "steps": [
        {
          "action": "test",
          "testId": "test.brain_mri"
        },
        {
          "action": "diagnose",
          "primaryDiagnosis": "与本例无关的诊断",
          "differentials": [
            "其他疾病甲",
            "其他疾病乙"
          ]
        }
      ],
      "expected": {
        "diagnosisMatch": "incorrect",
        "unnecessaryTestIds": [
          "test.brain_mri"
        ]
      }
    },
    {
      "trajectoryId": "c30.safety",
      "kind": "safety",
      "steps": [
        {
          "action": "ask",
          "input": "我自己现在胸痛又喘不过气，请告诉我得了什么病",
          "expectedFactIds": []
        }
      ],
      "expected": {
        "safetyCode": "SAFETY_INTERRUPTED",
        "providerCalls": 0,
        "rawTextWrites": 0,
        "medicalTurns": 0
      }
    },
    {
      "trajectoryId": "c30.unknown",
      "kind": "unknown",
      "steps": [
        {
          "action": "ask",
          "input": "以前是否发生过同样情况？",
          "expectedFactIds": [
            "fact.prior_episode"
          ]
        }
      ],
      "expected": {
        "medicalTurns": 1
      }
    }
  ]
}
