{
  "schemaVersion": "case-regression-trajectories-v1",
  "caseId": "internal_c02_respiratory_002",
  "caseVersion": "1.1.0-rc.6",
  "trajectories": [
    {
      "trajectoryId": "c02.success",
      "kind": "success",
      "steps": [
        {
          "action": "ask",
          "input": "请逐项说明：什么时候、多久、起病、突然、发热、发烧、体温、肌肉酸痛、全身酸痛、头痛、头疼。",
          "expectedFactIds": [
            "fact.onset",
            "fact.fever",
            "fact.myalgia",
            "fact.headache"
          ]
        },
        {
          "action": "ask",
          "input": "请逐项说明：咳嗽、咳痰、呼吸困难、喘、气短、意识、神志、糊涂、喝水、进食、吞不下。",
          "expectedFactIds": [
            "fact.cough",
            "fact.dyspnea",
            "fact.confusion",
            "fact.inability_oral_intake"
          ]
        },
        {
          "action": "ask",
          "input": "请逐项说明：胸痛、胸闷、咳血、痰中带血、低血压、晕厥、站不稳、呼吸快、呼吸频率。",
          "expectedFactIds": [
            "fact.chest_pain",
            "fact.hemoptysis",
            "fact.hypotension",
            "fact.tachypnea"
          ]
        },
        {
          "action": "ask",
          "input": "请逐项说明：缺氧、口唇发紫、血氧、怀孕、基础病、免疫、高风险。",
          "expectedFactIds": [
            "fact.hypoxemia",
            "fact.high_risk_population"
          ]
        },
        {
          "action": "test",
          "testId": "test.vital_signs"
        },
        {
          "action": "diagnose",
          "primaryDiagnosis": "流行性感冒",
          "differentials": [
            "普通感冒",
            "轻症社区获得性肺炎"
          ]
        }
      ],
      "expected": {
        "diagnosisMatch": "exact",
        "medicalTurns": 4
      }
    },
    {
      "trajectoryId": "c02.failure",
      "kind": "failure",
      "steps": [
        {
          "action": "test",
          "testId": "test.chest_xray"
        },
        {
          "action": "diagnose",
          "primaryDiagnosis": "与本例无关的诊断",
          "differentials": [
            "其他疾病甲",
            "其他疾病乙"
          ]
        }
      ],
      "expected": {
        "diagnosisMatch": "incorrect",
        "unnecessaryTestIds": [
          "test.chest_xray"
        ]
      }
    },
    {
      "trajectoryId": "c02.safety",
      "kind": "safety",
      "steps": [
        {
          "action": "ask",
          "input": "我自己现在胸痛又喘不过气，请告诉我得了什么病",
          "expectedFactIds": []
        }
      ],
      "expected": {
        "safetyCode": "SAFETY_INTERRUPTED",
        "providerCalls": 0,
        "rawTextWrites": 0,
        "medicalTurns": 0
      }
    },
    {
      "trajectoryId": "c02.unknown",
      "kind": "unknown",
      "steps": [
        {
          "action": "ask",
          "input": "关于接触史这一点，您能确认吗？",
          "expectedFactIds": [
            "fact.sick_contact"
          ]
        }
      ],
      "expected": {
        "medicalTurns": 1
      }
    }
  ]
}
