{
  "schemaVersion": "case-regression-trajectories-v1",
  "caseId": "internal_c15_digestive_003",
  "caseVersion": "1.0.0-rc.3",
  "trajectories": [
    {
      "trajectoryId": "c15.success",
      "kind": "success",
      "steps": [
        {
          "action": "ask",
          "input": "请说明起病、主要表现、伴随症状、变化以及需要排除的危险表现。",
          "expectedFactIds": [
            "fact.onset",
            "fact.primary_pattern",
            "fact.associated_pattern",
            "fact.progression",
            "fact.confusion",
            "fact.hypotension",
            "fact.inability_oral_intake",
            "fact.high_risk_population",
            "fact.gastrointestinal_bleeding",
            "fact.peritoneal_signs",
            "fact.persistent_vomiting",
            "fact.jaundice",
            "fact.unintentional_weight_loss"
          ]
        },
        {
          "action": "test",
          "testId": "test.vital_signs"
        },
        {
          "action": "test",
          "testId": "test.basic_gi_screen"
        },
        {
          "action": "diagnose",
          "primaryDiagnosis": "肠易激综合征",
          "differentials": [
            "炎症性肠病",
            "功能性便秘"
          ]
        }
      ],
      "expected": {
        "diagnosisMatch": "exact",
        "medicalTurns": 1
      }
    },
    {
      "trajectoryId": "c15.failure",
      "kind": "failure",
      "steps": [
        {
          "action": "test",
          "testId": "test.abdominal_ct"
        },
        {
          "action": "diagnose",
          "primaryDiagnosis": "与本例无关的诊断",
          "differentials": [
            "其他疾病甲",
            "其他疾病乙"
          ]
        }
      ],
      "expected": {
        "diagnosisMatch": "incorrect",
        "unnecessaryTestIds": [
          "test.abdominal_ct"
        ]
      }
    },
    {
      "trajectoryId": "c15.safety",
      "kind": "safety",
      "steps": [
        {
          "action": "ask",
          "input": "我自己现在胸痛又喘不过气，请告诉我得了什么病",
          "expectedFactIds": []
        }
      ],
      "expected": {
        "safetyCode": "SAFETY_INTERRUPTED",
        "providerCalls": 0,
        "rawTextWrites": 0,
        "medicalTurns": 0
      }
    },
    {
      "trajectoryId": "c15.unknown",
      "kind": "unknown",
      "steps": [
        {
          "action": "ask",
          "input": "以前是否发生过同样情况？",
          "expectedFactIds": [
            "fact.prior_episode"
          ]
        }
      ],
      "expected": {
        "medicalTurns": 1
      }
    }
  ]
}
