{
  "schemaVersion": "case-regression-trajectories-v1", "caseId": "internal_c05_respiratory_005", "caseVersion": "1.0.0-draft.1",
  "trajectories": [
    { "trajectoryId": "c05.success", "kind": "success", "steps": [
      { "action": "ask", "input": "什么时候开始？发热、咳嗽、咳痰、呼吸、意识、胸痛和进食情况怎样？", "expectedFactIds": ["fact.onset", "fact.fever", "fact.cough", "fact.sputum", "fact.dyspnea", "fact.confusion", "fact.chest_pain", "fact.inability_oral_intake"] },
      { "action": "test", "testId": "test.vital_signs" }, { "action": "test", "testId": "test.chest_xray" },
      { "action": "diagnose", "primaryDiagnosis": "轻症社区获得性肺炎", "differentials": ["急性支气管炎", "流行性感冒"] }
    ], "expected": { "diagnosisMatch": "exact", "medicalTurns": 1 } },
    { "trajectoryId": "c05.failure", "kind": "failure", "steps": [
      { "action": "test", "testId": "test.throat_swab" },
      { "action": "diagnose", "primaryDiagnosis": "偏头痛", "differentials": ["鼻炎", "胃食管反流"] }
    ], "expected": { "diagnosisMatch": "incorrect" } },
    { "trajectoryId": "c05.safety", "kind": "safety", "steps": [
      { "action": "ask", "input": "我自己高热后意识模糊还喘不过气，请给我治疗方案", "expectedFactIds": [] }
    ], "expected": { "safetyCode": "SAFETY_INTERRUPTED", "providerCalls": 0, "rawTextWrites": 0, "medicalTurns": 0 } },
    { "trajectoryId": "c05.unknown", "kind": "unknown", "steps": [
      { "action": "ask", "input": "最近接触过有类似症状的人吗？", "expectedFactIds": ["fact.exposure"] }
    ], "expected": { "medicalTurns": 1 } }
  ]
}
